{
  "version": "2.2",
  "project_name": "Project Replica",
  "project_data": {
    "project_name": "Project Replica",
    "tasks": [
      {
        "id": 1,
        "name": "Project Name",
        "start_date": "2025-10-30T00:00:00",
        "end_date": "2027-05-27T00:00:00",
        "percent_complete": 0,
        "predecessors": [],
        "assigned_resources": [],
        "notes": "",
        "parent_id": null,
        "is_summary": true,
        "is_milestone": false,
        "wbs": "1"
      },
      {
        "id": 2,
        "name": "Project Start Milestone",
        "start_date": "2025-10-30T00:00:00",
        "end_date": "2025-10-30T00:00:00",
        "percent_complete": 100,
        "predecessors": [],
        "assigned_resources": [
          [
            "Project",
            100
          ]
        ],
        "notes": "",
        "parent_id": 1,
        "is_summary": false,
        "is_milestone": true,
        "wbs": "1.1"
      },
      {
        "id": 3,
        "name": "Requirements",
        "start_date": "2025-10-31T00:00:00",
        "end_date": "2027-05-27T00:00:00",
        "percent_complete": 0,
        "predecessors": [],
        "assigned_resources": [],
        "notes": "tets",
        "parent_id": 1,
        "is_summary": true,
        "is_milestone": false,
        "wbs": "1.2"
      },
      {
        "id": 4,
        "name": "Find Scope",
        "start_date": "2025-10-31T00:00:00",
        "end_date": "2026-02-05T00:00:00",
        "percent_complete": 0,
        "predecessors": [
          [
            2,
            "FS",
            0
          ]
        ],
        "assigned_resources": [
          [
            "Security",
            100
          ],
          [
            "Project",
            100
          ]
        ],
        "notes": "",
        "parent_id": 3,
        "is_summary": false,
        "is_milestone": false,
        "wbs": "1.2.1"
      },
      {
        "id": 5,
        "name": "Create Plan",
        "start_date": "2026-02-06T00:00:00",
        "end_date": "2027-02-04T00:00:00",
        "percent_complete": 0,
        "predecessors": [
          [
            4,
            "FS",
            0
          ]
        ],
        "assigned_resources": [
          [
            "Security",
            100
          ]
        ],
        "notes": "",
        "parent_id": 3,
        "is_summary": false,
        "is_milestone": false,
        "wbs": "1.2.2"
      },
      {
        "id": 6,
        "name": "Get Plan Approval",
        "start_date": "2027-02-05T00:00:00",
        "end_date": "2027-05-27T00:00:00",
        "percent_complete": 0,
        "predecessors": [
          [
            5,
            "FS",
            0
          ]
        ],
        "assigned_resources": [
          [
            "Project",
            100
          ]
        ],
        "notes": "Get Approval",
        "parent_id": 3,
        "is_summary": false,
        "is_milestone": false,
        "wbs": "1.2.3"
      },
      {
        "id": 7,
        "name": "Project End",
        "start_date": "2027-05-28T00:00:00",
        "end_date": "2027-05-27T00:00:00",
        "percent_complete": 0,
        "predecessors": [
          [
            6,
            "FS",
            0
          ]
        ],
        "assigned_resources": [
          [
            "Project",
            100
          ]
        ],
        "notes": "",
        "parent_id": 1,
        "is_summary": false,
        "is_milestone": true,
        "wbs": "1.3"
      }
    ],
    "resources": [
      {
        "name": "Security",
        "max_hours_per_day": 8,
        "exceptions": [
          "2025-11-03 to 2025-11-05"
        ],
        "billing_rate": 10.0
      },
      {
        "name": "Project",
        "max_hours_per_day": 8,
        "exceptions": [],
        "billing_rate": 20.0
      },
      {
        "name": "test",
        "max_hours_per_day": 8.0,
        "exceptions": [],
        "billing_rate": 0.0
      },
      {
        "name": "test 2",
        "max_hours_per_day": 8.0,
        "exceptions": [],
        "billing_rate": 0.0
      },
      {
        "name": "test 3",
        "max_hours_per_day": 8.0,
        "exceptions": [],
        "billing_rate": 0.0
      },
      {
        "name": "test 4",
        "max_hours_per_day": 8.0,
        "exceptions": [],
        "billing_rate": 0.0
      },
      {
        "name": "test 5",
        "max_hours_per_day": 8.0,
        "exceptions": [],
        "billing_rate": 0.0
      },
      {
        "name": "test 6",
        "max_hours_per_day": 8.0,
        "exceptions": [],
        "billing_rate": 0.0
      },
      {
        "name": "test 7",
        "max_hours_per_day": 8.0,
        "exceptions": [],
        "billing_rate": 0.0
      },
      {
        "name": "test 8",
        "max_hours_per_day": 8.0,
        "exceptions": [],
        "billing_rate": 0.0
      },
      {
        "name": "t9",
        "max_hours_per_day": 8.0,
        "exceptions": [],
        "billing_rate": 0.0
      },
      {
        "name": "t10",
        "max_hours_per_day": 8.0,
        "exceptions": [],
        "billing_rate": 0.0
      },
      {
        "name": "t11",
        "max_hours_per_day": 8.0,
        "exceptions": [],
        "billing_rate": 0.0
      },
      {
        "name": "t12",
        "max_hours_per_day": 8.0,
        "exceptions": [],
        "billing_rate": 0.0
      }
    ]
  },
  "calendar_settings": {
    "working_days": [
      0,
      1,
      2,
      3,
      4
    ],
    "hours_per_day": 8.0,
    "non_working_days": []
  },
  "project_settings": {
    "duration_unit": "days",
    "default_date_format": "yyyy-mm-dd",
    "project_start_date": "2025-10-30T00:00:00"
  },
  "saved_at": "2025-11-05T22:21:35.043846",
  "metadata": {
    "total_tasks": 7,
    "summary_tasks": 2,
    "work_tasks": 5,
    "total_resources": 14,
    "overall_completion": 0.0,
    "duration_unit": "days"
  }
}